{"command":"version","generated_at":"2026-08-02T19:10:36.945Z","request_id":"093d5df2-c527-45a4-a50a-b9792d41c858","result":{"build_identity":"sha256:fbd6a21c1cd329e42d18c97eb926dbf5cc2d1a4a1d880bf5bf499a57b0a2a5e5","contract_manifest_digest":"sha256:f128d90b7006605cbbbf82e5304667269601e73674239ff608784c86e0212a85","contract_manifest_schema":"podway.contract-manifest/v1","product":"podway","source_commit":"8a1f2ad4727617239cae4cd809bcedf215c93c07","supported_ipc_ids":["podway.ipc/v1"],"target":"aarch64-apple-darwin","version":"0.1.1"},"schema":"podway.output/v1","warnings":[]}
